cid,house,name,type,state,short_name,room,phone,fax,session_year
929,House,"House Subcommittee on Bond Indebtedness",Subcommittee,TX,"Bond Indebtedness",NULL,NULL,NULL,2017
930,House,"House Select Committee on Texas Ports, Innovation & Infrastructure",Select,TX,"Texas Ports, Innovation & Infrastructure",NULL,NULL,NULL,2017
931,Senate,"Senate Standing Committee on Higher Education",Standing,TX,"Higher Education",NULL,NULL,NULL,2017
932,Senate,"Senate Standing Committee on Education",Standing,TX,Education,NULL,NULL,NULL,2017
933,Senate,"Senate Standing Committee on Business & Commerce",Standing,TX,"Business & Commerce",NULL,NULL,NULL,2017
934,Senate,"Senate Standing Committee on Committee of the Whole Senate",Standing,TX,"Committee of the Whole Senate",NULL,NULL,NULL,2017
935,Senate,"Senate Standing Committee on Finance",Standing,TX,Finance,NULL,NULL,NULL,2017
936,Senate,"Senate Standing Committee on Nominations",Standing,TX,Nominations,NULL,NULL,NULL,2017
937,Senate,"Senate Standing Committee on Intergovernmental Relations",Standing,TX,"Intergovernmental Relations",NULL,NULL,NULL,2017
938,Senate,"Senate Standing Committee on State Affairs",Standing,TX,"State Affairs",NULL,NULL,NULL,2017
939,Senate,"Senate Standing Committee on Health & Human Services",Standing,TX,"Health & Human Services",NULL,NULL,NULL,2017
940,Senate,"Senate Standing Committee on Criminal Justice",Standing,TX,"Criminal Justice",NULL,NULL,NULL,2017
941,Senate,"Senate Standing Committee on Administration",Standing,TX,Administration,NULL,NULL,NULL,2017
942,Senate,"Senate Standing Committee on Transportation",Standing,TX,Transportation,NULL,NULL,NULL,2017
943,Senate,"Senate Standing Committee on Agriculture, Water & Rural Affairs",Standing,TX,"Agriculture, Water & Rural Affairs",NULL,NULL,NULL,2017
944,Senate,"Senate Standing Committee on Natural Resources & Economic Development",Standing,TX,"Natural Resources & Economic Development",NULL,NULL,NULL,2017
945,Senate,"Senate Standing Committee on Veteran Affairs & Border Security",Standing,TX,"Veteran Affairs & Border Security",NULL,NULL,NULL,2017
946,Senate,"Senate Floor",Floor,TX,"Senate Floor",NULL,NULL,NULL,2017
947,House,"House Floor",Floor,TX,"House Floor",NULL,NULL,NULL,2017
948,Assembly,"Assembly Rules Subcommittee on Harassment, Discrimination, and Retaliation Prevention and Response",Subcommittee,CA,"Harassment, Discrimination, and Retaliation Prevention and Response",3016,"(916) 319-2800","(916) 319-2810",2017
949,Senate,"Senate Health Subcommittee on Healthcare Workforce and Access to Care",Subcommittee,CA,"Healthcare Workforce and Access to Care",2191,"(916) 266-9438","(916) 266-9438",2017
950,Senate,"Senate Select Committee on Government Reform",Select,TX,"Government Reform",NULL,NULL,NULL,2017
951,Joint,"Joint Administrative Procedures Committee",Joint,FL,"Joint Administrative Procedures",NULL,NULL,NULL,2017
952,Joint,"Joint Committee on Public Counsel Oversight",Joint,FL,"Public Counsel Oversight ",NULL,NULL,NULL,2017
953,Joint,"Joint Legislative Auditing Committee",Joint,FL,"Joint Legislative Auditing",NULL,NULL,NULL,2017
954,Joint,"Joint Legislative Budget Commission",Joint,FL,"Joint Legislative Budget Commission",NULL,NULL,NULL,2017
955,Joint,"Joint Select Committee on Collective Bargaining","Joint Select",FL,"Collective Bargaining",NULL,NULL,NULL,2017
957,Joint,"Conference Committee on Gaming",Joint,FL,"Conference Committee on Gaming",NULL,NULL,NULL,2017
958,Senate,"Senate Business, Professions and Economic Development Subcommittee on Professions and Licensure",Subcommittee,CA,"Professions and Licensur",NULL,NULL,NULL,2017
959,Joint,"Oversight Committee on Health & Human Services Transition",Oversight,TX,"Health & Human Services Transition","EXT E1.038","(512) 463-0370",NULL,2017
960,Joint,"Joint Administrative Procedures Committee",Joint,FL,"Joint Administrative Procedures",NULL,NULL,NULL,2018
961,Joint,"Joint Committee on Public Counsel Oversight",Joint,FL,"Public Counsel Oversight",NULL,NULL,NULL,2018
962,Joint,"Joint Legislative Auditing Committee",Joint,FL,"Joint Legislative Auditing",NULL,NULL,NULL,2018
963,Joint,"Joint Legislative Budget Commission",Joint,FL,"Joint Legislative Budget Commission",NULL,NULL,NULL,2018
964,Joint,"Joint Select Committee on Collective Bargaining","Joint Select",FL,"Collective Bargaining",NULL,NULL,NULL,2018
965,House,"House Select Committee on Economic Competitiveness",Select,TX,"Economic Competitiveness",NULL,NULL,NULL,2017
966,Assembly,"Assembly Select Committee on Waste Reduction and Recycling in 21st Century California",Select,CA,"Waste Reduction and Recycling in 21st Century California",NULL,NULL,NULL,2017
967,House,"House Select Committee on Opioids & Substance Abuse",Select,TX,"Opioids & Substance Abuse",NULL,NULL,NULL,2017
968,Senate,"Senate Select Committee on Employment Practices",Select,TX,"Employment Practices",NULL,NULL,NULL,2017
969,Senate,"Senate Select Committee on Property Tax Reform",Select,TX,"Property Tax Reform",NULL,NULL,NULL,2017
970,Senate,"Senate Select Committee on Election Security",Select,TX,"Election Security",NULL,NULL,NULL,2017
971,Joint,"Joint Committee on Government Facilities",Joint,TX,"Government Facilities",NULL,NULL,NULL,2017
972,Senate,"Senate Select Committee on Cybersecurity",Select,TX,Cybersecurity,NULL,NULL,NULL,2017
973,Joint,"Joint Conference Committee on SB 1 Senate and House Budget Conferees",Joint,TX,"Conference Committee on SB 1 Senate and House Budget Conferees",NULL,NULL,NULL,2017
975,House,"House Texas Legislative Medal of Honor",House,TX,"Legislative Medal of Honor",NULL,NULL,NULL,2017
976,Senate,"Senate State Water Implementation Fund for Texas Advisory Committee",Senate,TX,"State Water Implementation Fund for Texas Advisory Committee",NULL,NULL,NULL,2017
977,House,"House Select Committee on Hurricane Response and Preparedness",Select,FL,"Hurricane Response and Preparedness",NULL,NULL,NULL,2018
979,Senate,"Senate Texas Legislative Medal of Honor",Senate,TX,"Legislative Medal of Honor",NULL,NULL,NULL,2017
980,Joint,"Sunset Advisory Commission",Joint,TX,"Sunset Advisory Commission",NULL,NULL,NULL,2017
981,House,"House Select Subcommittee on Member Conduct",NULL,FL,"Select S/C on Member Conduct",NULL,NULL,NULL,2018
982,Senate,"Senate Standing Committee on Agriculture",Standing,FL,Agriculture,NULL,NULL,NULL,2018
983,Senate,"Senate Standing Committee on Banking and Insurance",Standing,FL,"Banking and Insurance",NULL,NULL,NULL,2018
984,Senate,"Senate Standing Committee on Children, Families, and Elder Affairs",Standing,FL,"Children, Families, and Elder Affairs",NULL,NULL,NULL,2018
985,Senate,"Senate Standing Committee on Commerce and Tourism",Standing,FL,"Commerce and Tourism",NULL,NULL,NULL,2018
986,Senate,"Senate Standing Committee on Communications, Energy, and Public Utilities",Standing,FL,"Communications, Energy, and Public Utilities",NULL,NULL,NULL,2018
987,Senate,"Senate Standing Committee on Community Affairs",Standing,FL,"Community Affairs",NULL,NULL,NULL,2018
988,Senate,"Senate Standing Committee on Criminal Justice",Standing,FL,"Criminal Justice",NULL,NULL,NULL,2018
989,Senate,"Senate Standing Committee on Environmental Preservation and Conservation",Standing,FL,"Environmental Preservation and Conservation",NULL,NULL,NULL,2018
990,Senate,"Senate Standing Committee on Governmental Oversight and Accountability",Standing,FL,"Governmental Oversight and Accountability",NULL,NULL,NULL,2018
991,Senate,"Senate Standing Committee on Judiciary",Standing,FL,Judiciary,NULL,NULL,NULL,2018
992,Senate,"Senate Standing Committee on Regulated Industries",Standing,FL,"Regulated Industries",NULL,NULL,NULL,2018
993,Senate,"Senate Standing Committee on Rules",Standing,FL,Rules,NULL,NULL,NULL,2018
994,Senate,"Senate Standing Committee on Transportation",Standing,FL,Transportation,NULL,NULL,NULL,2018
995,Senate,"Senate Standing Committee on Appropriations",Standing,FL,Appropriations,NULL,NULL,NULL,2018
996,Senate,"Senate Standing Committee on Ethics and Elections",Standing,FL,"Ethics and Elections",NULL,NULL,NULL,2018
997,Senate,"Senate Standing Committee on Health Policy",Standing,FL,"Health Policy",NULL,NULL,NULL,2018
998,Senate,"Senate Standing Committee on Military and Veterans Affairs, Space, and Domestic Security",Standing,FL,"Military and Veterans Affairs, Space, and Domestic Security",NULL,NULL,NULL,2018
999,Senate,"Senate Appropriations Subcommittee on Finance and Tax",Subcommittee,FL,"Finance and Tax",NULL,NULL,NULL,2018
1000,Senate,"Senate Appropriations Subcommittee on Health and Human Services",Subcommittee,FL,"Health and Human Services",NULL,NULL,NULL,2018
1001,Senate,"Senate Appropriations Subcommittee on Criminal and Civil Justice",Subcommittee,FL,"Criminal and Civil Justice",NULL,NULL,NULL,2018
1002,Senate,"Senate Appropriations Subcommittee on General Government",Subcommittee,FL,"General Government",NULL,NULL,NULL,2018
1003,Senate,"Senate Appropriations Subcommittee on the Environment and Natural Resources",Subcommittee,FL,"Environment and Natural Resources",NULL,NULL,NULL,2018
1004,Senate,"Senate Standing Committee on Education",Standing,FL,Education,NULL,NULL,NULL,2018
1005,Senate,"Senate Appropriations Subcommittee on Higher Education",Subcommittee,FL,"Higher Education",NULL,NULL,NULL,2018
1006,Senate,"Senate Appropriations Subcommittee on Pre-K - 12 Education",Subcommittee,FL,"Pre-K - 12 Education",NULL,NULL,NULL,2018
1007,Senate,"Senate Appropriations Subcommittee on Transportation, Tourism, and Economic Development",Subcommittee,FL,"Transportation, Tourism, and Economic Development",NULL,NULL,NULL,2018
1008,Senate,"Senate Floor",Floor,FL,"Senate Floor",NULL,NULL,NULL,2018
1009,Senate,"Senate Special Order Calendar Group",Special,FL,"Special Order Calendar Group",NULL,NULL,NULL,2018
1013,House,"House Standing Committee on Ways & Means",Standing,FL,"Ways & Means",NULL,NULL,NULL,2018
1014,House,"House Health & Human Services Committee Subcommittee on Health Innovation",Subcommittee,FL,"Health Innovation",NULL,NULL,NULL,2018
1015,House,"House Commerce Committee Subcommittee on Insurance & Banking",Subcommittee,FL,"Insurance & Banking",NULL,NULL,NULL,2018
1016,House,"House Commerce Committee Subcommittee on Careers & Competition",Subcommittee,FL,"Careers & Competition",NULL,NULL,NULL,2018
1017,House,"House Appropriations Committee Subcommittee on Government Operations & Technology Appropriations",Subcommittee,FL,"Government Operations & Technology Appropriations",NULL,NULL,NULL,2018
1018,House,"House Government Accountability Committee Subcommittee on Transportation & Infrastructure",Subcommittee,FL,"Transportation & Infrastructure",NULL,NULL,NULL,2018
1019,House,"House Education Committee Subcommittee on PreK-12 Innovation",Subcommittee,FL,"PreK-12 Innovation",NULL,NULL,NULL,2018
1020,House,"House Standing Committee on Appropriations",Standing,FL,Appropriations,NULL,NULL,NULL,2018
1021,House,"House Commerce Committee Subcommittee on Tourism & Gaming Control",Subcommittee,FL,"Tourism & Gaming Control",NULL,NULL,NULL,2018
1022,House,"House Appropriations Committee Subcommittee on PreK-12 Appropriations",Subcommittee,FL,"PreK-12 Appropriations",NULL,NULL,NULL,2018
1023,House,"House Education Committee Subcommittee on Post-Secondary Education",Subcommittee,FL,"Post-Secondary Education",NULL,NULL,NULL,2018
1024,House,"House Standing Committee on Public Integrity & Ethics",Standing,FL,"Public Integrity & Ethics",NULL,NULL,NULL,2018
1025,House,"House Appropriations Committee Subcommittee on Higher Education Appropriations",Subcommittee,FL,"Higher Education Appropriations",NULL,NULL,NULL,2018
1026,House,"House Commerce Committee Subcommittee on Agriculture & Property Rights",Subcommittee,FL,"Agriculture & Property Rights",NULL,NULL,NULL,2018
1027,House,"House Government Accountability Committee Subcommittee on Natural Resources & Public Lands",Subcommittee,FL,"Natural Resources & Public Lands",NULL,NULL,NULL,2018
1028,House,"House Commerce Committee Subcommittee on Energy & Utilities",Subcommittee,FL,"Energy & Utilities",NULL,NULL,NULL,2018
1029,House,"House Select Committee on Triumph Gulf Coast",Select,FL,"Triumph Gulf Coast",NULL,NULL,NULL,2018
1030,House,"House Appropriations Committee Subcommittee on Justice Appropriations",Subcommittee,FL,"Justice Appropriations",NULL,NULL,NULL,2018
1031,House,"House Government Accountability Committee Subcommittee on Oversight, Transparency & Administration",Subcommittee,FL,"Oversight, Transparency & Administration",NULL,NULL,NULL,2018
1032,House,"House Appropriations Committee Subcommittee on Health Care Appropriations",Subcommittee,FL,"Health Care Appropriations",NULL,NULL,NULL,2018
1033,House,"House Government Accountability Committee Subcommittee on Local, Federal & Veterans Affairs",Subcommittee,FL,"Local, Federal & Veterans Affairs",NULL,NULL,NULL,2018
1034,House,"House Health & Human Services Committee Subcommittee on Children, Families & Seniors",Subcommittee,FL,"Children, Families & Seniors",NULL,NULL,NULL,2018
1035,House,"House Health & Human Services Committee Subcommittee on Health Quality",Subcommittee,FL,"Health Quality",NULL,NULL,NULL,2018
1036,House,"House Standing Committee on Judiciary",Standing,FL,Judiciary,NULL,NULL,NULL,2018
1037,House,"House Standing Committee on Commerce",Standing,FL,Commerce,NULL,NULL,NULL,2018
1038,House,"House Appropriations Committee Subcommittee on Transportation & Tourism Appropriations",Subcommittee,FL,"Transportation & Tourism Appropriations",NULL,NULL,NULL,2018
1039,House,"House Standing Committee on Education",Standing,FL,Education,NULL,NULL,NULL,2018
1040,House,"House Judiciary Committee Subcommittee on Criminal Justice",Subcommittee,FL,"Criminal Justice",NULL,NULL,NULL,2018
1041,House,"House Education Committee Subcommittee on PreK-12 Quality",Subcommittee,FL,"PreK-12 Quality",NULL,NULL,NULL,2018
1042,House,"House Appropriations Committee Subcommittee on Agriculture & Natural Resources Appropriations",Subcommittee,FL,"Agriculture & Natural Resources Appropriations",NULL,NULL,NULL,2018
1043,House,"House Standing Committee on Government Accountability",Standing,FL,"Government Accountability",NULL,NULL,NULL,2018
1044,House,"House Judiciary Committee Subcommittee on Civil Justice & Claims",Subcommittee,FL,"Civil Justice & Claims",NULL,NULL,NULL,2018
1045,House,"House Standing Committee on Health & Human Services",Standing,FL,"Health & Human Services",NULL,NULL,NULL,2018
1046,House,"House Standing Committee on Rules & Policy",Standing,FL,"Rules & Policy",NULL,NULL,NULL,2018
1047,House,"House Floor",Floor,FL,"House Floor",NULL,NULL,NULL,2018
1078,Joint,"Joint Committee on Partnership Advisory Commission",Joint,TX,"Partnership Advisory Commission",NULL,NULL,NULL,2017
1083,Joint,"Rules Subcommittee on Sexual Harassment Prevention and Response",Joint,CA,"Subcommittee on Sexual Harassment Prevention and Respons",NULL,NULL,NULL,2017
1084,Senate,"Senate Joint Committee on Rules Subcommittee on Sexual Harassment Prevention and Response",Subcommittee,CA,"Sexual Harassment Prevention and Respons",NULL,NULL,NULL,2017
1085,Assembly,"Assembly Joint Committee on Rules Subcommittee on Sexual Harassment Prevention and Response",Subcommittee,CA,"Sexual Harassment Prevention and Respons",NULL,NULL,NULL,2017
1086,Assembly,"Assembly Select Committee on Intellectual and Developmental Disabilities",Select,CA,"Intellectual and Developmental Disabilities",NULL,NULL,NULL,2017
1087,Assembly,"Assembly Select Committee on Census",Select,CA,Census,NULL,NULL,NULL,2017
1088,Assembly,"Assembly Select Committee on Natural Disaster Response, Recover, and Rebuilding",Select,CA,"Natural Disaster Response, Recover, and Rebuilding",NULL,NULL,NULL,2017
1090,Joint,"Joint Interim Committee on Higher Education Formula Funding",Joint,TX,"Interim C on Higher Education Formula Funding",NULL,NULL,NULL,2017
1091,Senate,"Senate Select Committee on 2020 United States Census",Select,CA,"2020 United States Census",NULL,NULL,NULL,2017
1092,Senate,"Senate Standing Committee on State-Native American Relations",Standing,NY,"State-Native American Relations",NULL,NULL,NULL,2017
1093,Senate,"Senate Standing Committee on New York State Conference of Black Senators",Standing,NY,"New York State Conference of Black Senators",NULL,NULL,NULL,2017
1094,Senate,"Senate Standing Committee on Puerto Rican/Latino Caucus",Standing,NY,"Puerto Rican/Latino Caucus",NULL,NULL,NULL,2017
1095,Senate,"Senate Standing Committee on Libraries",Standing,NY,Libraries,NULL,NULL,NULL,2017
1096,Senate,"Senate Standing Committee on New York City Education Subcommittee",Standing,NY,"New York City Education Subcommittee",NULL,NULL,NULL,2017
1097,Senate,"Senate Standing Committee on Science, Technology, Incubation and Entrepreneurship",Standing,NY,"Science, Technology, Incubation and Entrepreneurship",NULL,NULL,NULL,2017
1098,Senate,"Senate Standing Committee on Heroin Task Force",Standing,NY,"Heroin Task Force",NULL,NULL,NULL,2017
1099,Senate,"Senate Standing Committee on Task Force on Lyme and Tick-Borne Diseases",Standing,NY,"Task Force on Lyme and Tick-Borne Diseases",NULL,NULL,NULL,2017
1100,Senate,"Senate Standing Committee on Legislative Commission on Rural Resources",Standing,NY,"Legislative Commission on Rural Resources",NULL,NULL,NULL,2017
1101,Senate,"Senate Standing Committee on Administrative Regulations Review Commission (ARRC)",Standing,NY,"Administrative Regulations Review Commission (ARRC)",NULL,NULL,NULL,2017
1102,Senate,"Senate Standing Committee on Senate Majority Task Force on Counterterrorism and Public Protection",Standing,NY,"Senate Majority Task Force on Counterterrorism and Public Protection",NULL,NULL,NULL,2017
1103,Senate,"Senate Standing Committee on Task Force for Demographic Research and Reapportionment",Standing,NY,"Task Force for Demographic Research and Reapportionment",NULL,NULL,NULL,2017
1104,Senate,"Senate Standing Committee on Ethics and Internal Governance",Standing,NY,"Ethics and Internal Governance",NULL,NULL,NULL,2017
1105,Senate,"Senate Standing Committee on Technology and Innovation",Standing,NY,"Technology and Innovation",NULL,NULL,NULL,2017
1106,Senate,"Senate Standing Committee on Task Force on Workforce Development",Standing,NY,"Task Force on Workforce Development",NULL,NULL,NULL,2017
1107,Assembly,"Assembly Select Committee on California's Energy Future",Select,CA,"California's Energy Futur",NULL,NULL,NULL,2017
1108,House,"House Select Committee on Cybersecurity",Select,TX,Cybersecurity,NULL,NULL,NULL,2017
1109,Assembly,"Assembly Select Committee on 2028 Olympic and Paralympic Games",Select,CA,"2028 Olympic and Paralympic Games",NULL,NULL,NULL,2017
1110,Senate,"Senate Standing Committee on Latino Caucus",Standing,NY,"Latino Caucus",NULL,NULL,NULL,2017
1111,Joint,"Joint Legislative Committee on Aging",Joint,TX,"Legislative C on Aging",NULL,NULL,NULL,2017
1112,Senate,"Senate Select Committee on Violence in Schools & School Security",Select,TX,"Violence in Schools & School Security",NULL,NULL,NULL,2017
1113,Assembly,"Assembly Select Committee on Natural Disaster Response, Recovery, and Rebuilding",Select,CA,"Natural Disaster Response, Recovery, and Rebuilding",NULL,NULL,NULL,2017
1114,Senate,"Senate Committee on Wildfire Preparedness and Response Legislative Conference Committee",Other,CA,"Wildfire Preparedness and Response Legislative Conference Commi",NULL,NULL,NULL,2017
1115,Joint,"Joint Conference Committee",Joint,CA,"Joint Conference Committee",NULL,NULL,NULL,2017
1116,Senate,"Senate Joint Legislative Budget Committee Subcommittee on the Selection of the Legislative Analyst",Subcommittee,CA,"Selection of the Legislative Analys",NULL,NULL,NULL,2017
1117,Assembly,"Assembly Joint Legislative Budget Subcommittee on the Selection of the Legislative Analyst",Subcommittee,CA,"Selection of the Legislative Analys",NULL,NULL,NULL,2017
1118,House,"House Subcommittee on Post-Secondary & Workforce Readiness",Subcommittee,TX,"Post-Secondary & Workforce Readiness",NULL,NULL,NULL,2017
1119,House,"House Subcommittee on Long-term Infrastructure Planning",Subcommittee,TX,"Long-term Infrastructure Planning",NULL,NULL,NULL,2017
1120,Joint,"Joint Legislative Committee on Oversight of Compact Facility",Joint,TX,"Joint Committee on Oversight of Compact Facility",NULL,NULL,NULL,2017
1121,Joint,"Joint Interim Committee on Disclosure of Emergency Call Information",Interim,TX,"Joint Interim Comm on Disclosure of Emergency Call Information",NULL,NULL,NULL,2017
1122,Joint,"Joint Committee on State Judicial Salaries",Joint,TX,"Joint Comm on State Judicial Salaries",NULL,NULL,NULL,2017
1123,Joint,"Joint Interim Committee on Prescribing & Dispensing Controlled Substances",Interim,TX,"Joint Interim C. on Prescribing & Dispensing Controlled Substances",NULL,NULL,NULL,2017
1124,Joint,"State Water Implementation Fund for Texas Advisory Committee",Joint,TX,"State Water Implementation Fund",NULL,NULL,NULL,2017
1125,Assembly,"Assembly Standing Committee on Public Employment and Retirement",Standing,CA,"Public Employment and Retiremen",NULL,NULL,NULL,2017
1126,Senate,"Senate Standing Committee on Agriculture",Standing,CA,Agricultur,NULL,NULL,NULL,2019
1127,Senate,"Senate Standing Committee on Appropriations",Standing,CA,Appropriations,NULL,NULL,NULL,2019
1128,Senate,"Senate Standing Committee on Banking and Financial Institutions",Standing,CA,"Banking and Financial Institutions",NULL,NULL,NULL,2019
1129,Senate,"Senate Standing Committee on Budget and Fiscal Review",Standing,CA,"Budget and Fiscal Review",NULL,NULL,NULL,2019
1130,Senate,"Senate Standing Committee on Business, Professions and Economic Development",Standing,CA,"Business, Professions and Economic Developmen",NULL,NULL,NULL,2019
1131,Senate,"Senate Standing Committee on Education",Standing,CA,Education,NULL,NULL,NULL,2019
1132,Senate,"Senate Standing Committee on Elections and Constitutional Amendments",Standing,CA,"Elections and Constitutional Amendments",NULL,NULL,NULL,2019
1133,Senate,"Senate Standing Committee on Energy, Utilities and Communications",Standing,CA,"Energy, Utilities and Communications",NULL,NULL,NULL,2019
1134,Senate,"Senate Standing Committee on Environmental Quality",Standing,CA,"Environmental Quality",NULL,NULL,NULL,2019
1135,Senate,"Senate Standing Committee on Governance and Finance",Standing,CA,"Governance and Financ",NULL,NULL,NULL,2019
1136,Senate,"Senate Standing Committee on Governmental Organization",Standing,CA,"Governmental Organization",NULL,NULL,NULL,2019
1137,Senate,"Senate Standing Committee on Health",Standing,CA,Heal,NULL,NULL,NULL,2019
1138,Senate,"Senate Standing Committee on Human Services",Standing,CA,"Human Services",NULL,NULL,NULL,2019
1139,Senate,"Senate Standing Committee on Insurance",Standing,CA,Insuranc,NULL,NULL,NULL,2019
1140,Senate,"Senate Standing Committee on Judiciary",Standing,CA,Judiciary,NULL,NULL,NULL,2019
1141,Senate,"Senate Standing Committee on Labor and Industrial Relations",Standing,CA,"Labor and Industrial Relations",NULL,NULL,NULL,2019
1142,Senate,"Senate Standing Committee on Natural Resources and Water",Standing,CA,"Natural Resources and Water",NULL,NULL,NULL,2019
1143,Senate,"Senate Standing Committee on Public Employment and Retirement",Standing,CA,"Public Employment and Retiremen",NULL,NULL,NULL,2019
1144,Senate,"Senate Standing Committee on Public Safety",Standing,CA,"Public Safety",NULL,NULL,NULL,2019
1145,Senate,"Senate Standing Committee on Rules",Standing,CA,Rules,NULL,NULL,NULL,2019
1146,Senate,"Senate Standing Committee on Transportation and Housing",Standing,CA,"Transportation and Housing",NULL,NULL,NULL,2019
1147,Senate,"Senate Standing Committee on Veterans Affairs",Standing,CA,"Veterans Affairs",NULL,NULL,NULL,2019
1148,Senate,"Senate Joint Legislative Budget Committee Subcommittee on the Selection of the Legislative Analyst",Subcommittee,CA,"Selection of the Legislative Analys",NULL,NULL,NULL,2019
1149,Joint,"Joint Legislative Budget Committee",Joint,CA,"Joint Legislative Budget Commi",NULL,NULL,NULL,2019
1150,Senate,"Senate Committee on Legislative Ethics",Other,CA,"Legislative Ethics",NULL,NULL,NULL,2019
1151,Assembly,"Assembly Standing Committee on Accountability and Administrative Review",Standing,CA,"Accountability and Administrative Review",NULL,NULL,NULL,2019
1152,Assembly,"Assembly Standing Committee on Aging and Long-Term Care",Standing,CA,"Aging and Long-Term Car",NULL,NULL,NULL,2019
1153,Assembly,"Assembly Standing Committee on Agriculture",Standing,CA,Agricultur,NULL,NULL,NULL,2019
1154,Assembly,"Assembly Standing Committee on Appropriations",Standing,CA,Appropriations,NULL,NULL,NULL,2019
1155,Assembly,"Assembly Standing Committee on Arts, Entertainment, Sports, Tourism, and Internet Media",Standing,CA,"Arts, Entertainment, Sports, Tourism, and Internet Media",NULL,NULL,NULL,2019
1156,Assembly,"Assembly Standing Committee on Banking and Finance",Standing,CA,"Banking and Financ",NULL,NULL,NULL,2019
1157,Assembly,"Assembly Standing Committee on Budget",Standing,CA,Budg,NULL,NULL,NULL,2019
1158,Assembly,"Assembly Standing Committee on Business and Professions",Standing,CA,"Business and Professions",NULL,NULL,NULL,2019
1159,Assembly,"Assembly Standing Committee on Communications and Conveyance",Standing,CA,"Communications and Conveyanc",NULL,NULL,NULL,2019
1160,Assembly,"Assembly Standing Committee on Education",Standing,CA,Education,NULL,NULL,NULL,2019
1161,Assembly,"Assembly Standing Committee on Elections and Redistricting",Standing,CA,"Elections and Redistricting",NULL,NULL,NULL,2019
1162,Assembly,"Assembly Standing Committee on Environmental Safety and Toxic Materials",Standing,CA,"Environmental Safety and Toxic Materials",NULL,NULL,NULL,2019
1163,Assembly,"Assembly Standing Committee on Governmental Organization",Standing,CA,"Governmental Organization",NULL,NULL,NULL,2019
1164,Assembly,"Assembly Standing Committee on Health",Standing,CA,Heal,NULL,NULL,NULL,2019
