cid,house,name,type,state,short_name,room,phone,fax,session_year
365,Assembly,"Assembly Subcommittee on Agriculture Economic Development and Farmland Protection",Subcommittee,NY,"Agriculture Economic Development and Farmland Protection",NULL,NULL,NULL,2015
366,Assembly,"Assembly Subcommittee on Autism Retention",Subcommittee,NY,"Autism Retention",NULL,NULL,NULL,2015
367,Assembly,"Assembly Subcommittee on Banking in Underserved Communities",Subcommittee,NY,"Banking in Underserved Communities",NULL,NULL,NULL,2015
368,Assembly,"Assembly Subcommittee on Catastrophic Natural Disasters",Subcommittee,NY,"Catastrophic Natural Disasters",NULL,NULL,NULL,2015
369,Assembly,"Assembly Subcommittee on Child Product Safety",Subcommittee,NY,"Child Product Safety",NULL,NULL,NULL,2015
370,Assembly,"Assembly Subcommittee on Community Integration ",Subcommittee,NY,"Community Integration ",NULL,NULL,NULL,2015
371,Assembly,"Assembly Subcommittee on Consumer Fraud Protection ",Subcommittee,NY,"Consumer Fraud Protection ",NULL,NULL,NULL,2015
372,Assembly,"Assembly Subcommittee on Criminal Procedure",Subcommittee,NY,"Criminal Procedure",NULL,NULL,NULL,2015
373,Assembly,"Assembly Subcommittee on Diversity in Law ",Subcommittee,NY,"Diversity in Law ",NULL,NULL,NULL,2015
374,Assembly,"Assembly Subcommittee on Effective Treatment",Subcommittee,NY,"Effective Treatment",NULL,NULL,NULL,2015
375,Assembly,"Assembly Subcommittee on Election Day Operations and Voter Disenfranchisement",Subcommittee,NY,"Election Day Operations and Voter Disenfranchisement",NULL,NULL,NULL,2015
376,Assembly,"Assembly Subcommittee on Emerging Workforce",Subcommittee,NY,"Emerging Workforce",NULL,NULL,NULL,2015
377,Assembly,"Assembly Subcommittee on Export Trade",Subcommittee,NY,"Export Trade",NULL,NULL,NULL,2015
378,Assembly,"Assembly Subcommittee on Foster Care",Subcommittee,NY,"Foster Care",NULL,NULL,NULL,2015
379,Assembly,"Assembly Subcommittee on Infrastructure",Subcommittee,NY,Infrastructure,NULL,NULL,NULL,2015
380,Assembly,"Assembly Subcommittee on Insurer Investments and Market Practices in Underserved Areas",Subcommittee,NY,"Insurer Investments and Market Practices in Underserved Areas",NULL,NULL,NULL,2015
381,Assembly,"Assembly Subcommittee on Intergenerational Care ",Subcommittee,NY,"Intergenerational Care ",NULL,NULL,NULL,2015
382,Assembly,"Assembly Subcommittee on Intergovernmental Consumer Affairs",Subcommittee,NY,"Intergovernmental Consumer Affairs",NULL,NULL,NULL,2015
383,Assembly,"Assembly Subcommittee on Micro Business ",Subcommittee,NY,"Micro Business ",NULL,NULL,NULL,2015
384,Assembly,"Assembly Subcommittee on Mitchell-Lama",Subcommittee,NY,Mitchell-Lama,NULL,NULL,NULL,2015
385,Assembly,"Assembly Subcommittee on Museums & Cultural Institutions ",Subcommittee,NY,"Museums & Cultural Institutions ",NULL,NULL,NULL,2015
386,Assembly,"Assembly Subcommittee on Outreach and Oversight of Senior Citizen Programs",Subcommittee,NY,"Outreach and Oversight of Senior Citizen Programs",NULL,NULL,NULL,2015
387,Assembly,"Assembly Subcommittee on Oversight of Minority and Women-Owned Business Enterprises (MWBEs)",Subcommittee,NY,"Oversight of Minority and Women-Owned Business Enterprises (MWBEs)",NULL,NULL,NULL,2015
388,Assembly,"Assembly Subcommittee on Oversight of the Department of Environmental Conservation",Subcommittee,NY,"Oversight of the Department of Environmental Conservation",NULL,NULL,NULL,2015
389,Assembly,"Assembly Subcommittee on Regional Tourism Development",Subcommittee,NY,"Regional Tourism Development",NULL,NULL,NULL,2015
390,Assembly,"Assembly Subcommittee on Regulated Mortgage Lenders",Subcommittee,NY,"Regulated Mortgage Lenders",NULL,NULL,NULL,2015
391,Assembly,"Assembly Subcommittee on Renewable Energy",Subcommittee,NY,"Renewable Energy",NULL,NULL,NULL,2015
392,Assembly,"Assembly Subcommittee on Retention of Homeownership and Stabilization of Affordable Housing",Subcommittee,NY,"Retention of Homeownership and Stabilization of Affordable Housing",NULL,NULL,NULL,2015
393,Assembly,"Assembly Subcommittee on Students with Special Needs",Subcommittee,NY,"Students with Special Needs",NULL,NULL,NULL,2015
394,Assembly,"Assembly Subcommittee on Transitional Services",Subcommittee,NY,"Transitional Services",NULL,NULL,NULL,2015
395,Assembly,"Assembly Subcommittee on Trust and Estates",Subcommittee,NY,"Trust and Estates",NULL,NULL,NULL,2015
396,Assembly,"Assembly Subcommittee on Tuition Assistance Program",Subcommittee,NY,"Tuition Assistance Program",NULL,NULL,NULL,2015
397,Assembly,"Assembly Subcommittee on Volunteer Emergency Services",Subcommittee,NY,"Volunteer Emergency Services",NULL,NULL,NULL,2015
398,Assembly,"Assembly Subcommittee on Women Veterans",Subcommittee,NY,"Women Veterans",NULL,NULL,NULL,2015
399,Assembly,"Assembly Subcommittee on Women's Health",Subcommittee,NY,"Women's Health",NULL,NULL,NULL,2015
400,Assembly,"Assembly Subcommittee on Workplace Safety",Subcommittee,NY,"Workplace Safety",NULL,NULL,NULL,2015
401,Assembly,"Assembly Legislative Commission on Administrative Regulations Review","Legislative Commissions",NY,"Administrative Regulations Review",NULL,NULL,NULL,2015
402,Assembly,"Assembly Legislative Commission on Council on Health Care Financing","Legislative Commissions",NY,"Council on Health Care Financing",NULL,NULL,NULL,2015
403,Assembly,"Assembly Legislative Commission on Critical Transportation Choices","Legislative Commissions",NY,"Critical Transportation Choices",NULL,NULL,NULL,2015
404,Assembly,"Assembly Legislative Commission on Government Administration","Legislative Commissions",NY,"Government Administration",NULL,NULL,NULL,2015
405,Assembly,"Assembly Legislative Commission on Legislative Ethics","Legislative Commissions",NY,"Legislative Ethics",NULL,NULL,NULL,2015
406,Assembly,"Assembly Legislative Commission on Rural Resources","Legislative Commissions",NY,"Rural Resources",NULL,NULL,NULL,2015
407,Assembly,"Assembly Legislative Commission on Science and Technology","Legislative Commissions",NY,"Science and Technology",NULL,NULL,NULL,2015
408,Assembly,"Assembly Legislative Commission on Skills Development and Career Education","Legislative Commissions",NY,"Skills Development and Career Education",NULL,NULL,NULL,2015
409,Assembly,"Assembly Legislative Commission on Solid Waste Management","Legislative Commissions",NY,"Solid Waste Management",NULL,NULL,NULL,2015
410,Assembly,"Assembly Legislative Commission on State-Local Relations","Legislative Commissions",NY,"State-Local Relations",NULL,NULL,NULL,2015
411,Assembly,"Assembly Legislative Commission on Tax Study","Legislative Commissions",NY,"Tax Study",NULL,NULL,NULL,2015
412,Assembly,"Assembly Legislative Commission on Toxic Substances and Hazardous Wastes","Legislative Commissions",NY,"Toxic Substances and Hazardous Wastes",NULL,NULL,NULL,2015
413,Assembly,"Assembly Legislative Commission on Water Resource Needs of NYS & Long Island","Legislative Commissions",NY,"Water Resource Needs of NYS & Long Island",NULL,NULL,NULL,2015
414,Assembly,"Assembly Task Force on Black, Puerto Rican, Hispanic & Asian Legislative Caucus","Task Forces and Other Entities",NY,"Black, Puerto Rican, Hispanic & Asian Legislative Caucus",NULL,NULL,NULL,2015
415,Assembly,"Assembly Task Force on Child Care Workgroup","Task Forces and Other Entities",NY,"Child Care Workgroup",NULL,NULL,NULL,2015
416,Assembly,"Assembly Task Force on Democratic Study Group","Task Forces and Other Entities",NY,"Democratic Study Group",NULL,NULL,NULL,2015
417,Assembly,"Assembly Task Force on Demographic Research and Reapportionment","Task Forces and Other Entities",NY,"Demographic Research and Reapportionment",NULL,NULL,NULL,2015
418,Assembly,"Assembly Task Force on Food, Farm & Nutrition Policy","Task Forces and Other Entities",NY,"Food, Farm & Nutrition Policy",NULL,NULL,NULL,2015
419,Assembly,"Assembly Task Force on Homeless","Task Forces and Other Entities",NY,Homeless,NULL,NULL,NULL,2015
420,Assembly,"Assembly Task Force on Joint Advisory Board on Broadcast of State Government Proceedings","Task Forces and Other Entities",NY,"Joint Advisory Board on Broadcast of State Government Proceedings",NULL,NULL,NULL,2015
421,Assembly,"Assembly Task Force on Legislative Women's Caucus","Task Forces and Other Entities",NY,"Legislative Women's Caucus",NULL,NULL,NULL,2015
422,Assembly,"Assembly Task Force on Long Island Sound","Task Forces and Other Entities",NY,"Long Island Sound",NULL,NULL,NULL,2015
423,Assembly,"Assembly Task Force on Mohawk Valley","Task Forces and Other Entities",NY,"Mohawk Valley",NULL,NULL,NULL,2015
424,Assembly,"Assembly Task Force on New Americans","Task Forces and Other Entities",NY,"New Americans",NULL,NULL,NULL,2015
425,Assembly,"Assembly Task Force on NYC School Governance","Task Forces and Other Entities",NY,"NYC School Governance",NULL,NULL,NULL,2015
426,Assembly,"Assembly Task Force on People with Disabilities","Task Forces and Other Entities",NY,"People with Disabilities",NULL,NULL,NULL,2015
427,Assembly,"Assembly Task Force on Puerto Rican/Hispanic","Task Forces and Other Entities",NY,"Puerto Rican/Hispanic",NULL,NULL,NULL,2015
428,Assembly,"Assembly Task Force on State-Federal Relations","Task Forces and Other Entities",NY,"State-Federal Relations",NULL,NULL,NULL,2015
429,Assembly,"Assembly Task Force on University-Industry Cooperation","Task Forces and Other Entities",NY,"University-Industry Cooperation",NULL,NULL,NULL,2015
430,Assembly,"Assembly Task Force on Women's Issues","Task Forces and Other Entities",NY,"Women's Issues",NULL,NULL,NULL,2015
431,Assembly,"Subcommittee on Medical Cannabis Licensing and Regulation",NULL,CA,"Medical Cannabis Licensing and Regulation",NULL,NULL,NULL,2015
432,Senate,"Senate Select Committee on Asian Pacific Islander Affairs",Select,CA,"Asian Pacific Islander Affairs",NULL,NULL,NULL,2015
433,Joint,"Conference Committee on SB 2 and AB 1",Joint,CA,"SB 2 and AB 1",NULL,NULL,NULL,2015
434,Senate,"Senate Select Committee on Sacramento–San Joaquin Delta",Select,CA,"Sacramento–San Joaquin Delta",NULL,NULL,NULL,2015
435,Assembly,"Assembly Floor",Floor,CA,Floor,NULL,NULL,NULL,2015
436,Assembly,"Assembly Budget Subcommittee No. 1 on Health and Human Services","Budget Subcommittee",CA,"Health and Human Services",NULL,NULL,NULL,2015
437,Assembly,"Assembly Budget Subcommittee No. 2 on Education Finance","Budget Subcommittee",CA,"Education Finance",NULL,NULL,NULL,2015
438,Assembly,"Assembly Budget Subcommittee No. 3 on Resources and Transportation","Budget Subcommittee",CA,"Resources and Transportation",NULL,NULL,NULL,2015
439,Assembly,"Assembly Budget Subcommittee No. 4 on State Administration","Budget Subcommittee",CA,"State Administration",NULL,NULL,NULL,2015
440,Assembly,"Assembly Budget Subcommittee No. 5 on Public Safety","Budget Subcommittee",CA,"Public Safety",NULL,NULL,NULL,2015
441,Assembly,"Assembly Budget Subcommittee No. 6 on Budget Process Oversight and Program Evaluation","Budget Subcommittee",CA,"Budget Process Oversight and Program Evaluation",NULL,NULL,NULL,2015
442,Assembly,"Assembly Select Committee on Expanding Access to California's Natural Resources",Select,CA,"Expanding Access to California's Natural Resources",NULL,NULL,NULL,2015
444,Assembly,"Assembly Select Committee on Regional Planning in the San Francisco Bay Area",Select,CA,"Regional Planning in the San Francisco Bay Area",NULL,NULL,NULL,2015
445,Assembly,"Assembly 1st Extraordinary Session on Finance",Extraordinary,CA,Finance,NULL,NULL,NULL,2015
446,Assembly,"Assembly 1st Extraordinary Session on Rules",Extraordinary,CA,Rules,NULL,NULL,NULL,2015
447,Assembly,"Assembly 1st Extraordinary Session on Transportation and Infrastructure Development",Extraordinary,CA,"Transportation and Infrastructure Development",NULL,NULL,NULL,2015
448,Assembly,"Assembly 2nd Extraordinary Session on Finance",Extraordinary,CA,Finance,NULL,NULL,NULL,2015
449,Assembly,"Assembly 2nd Extraordinary Session on Public Health and Developmental Services",Extraordinary,CA,"Public Health and Developmental Services",NULL,NULL,NULL,2015
450,Assembly,"Assembly 2nd Extraordinary Session on Rules",Extraordinary,CA,Rules,NULL,NULL,NULL,2015
451,Assembly,"Assembly Special Committee on Assembly Legislative Ethics",Special,CA,"Assembly Legislative Ethics",NULL,NULL,NULL,2015
452,Senate,"Senate Floor",Floor,CA,Floor,NULL,NULL,NULL,2015
453,Senate,"Senate Agriculture Subcommittee on Olive Oil Production and Emerging Products",Subcommittee,CA,"Olive Oil Production and Emerging Products",NULL,NULL,NULL,2015
454,Senate,"Senate Agriculture Subcommittee on Invasive Species",Subcommittee,CA,"Invasive Species",NULL,NULL,NULL,2015
455,Senate,"Senate Budget and Fiscal Review Subcommittee No. 1 on Education","Budget Subcommittee",CA,Education,NULL,NULL,NULL,2015
456,Senate,"Senate Budget and Fiscal Review Subcommittee No. 2 on Resources, Environmental Protection, Energy and Transportation","Budget Subcommittee",CA,"Resources, Environmental Protection, Energy and Transportation",NULL,NULL,NULL,2015
457,Senate,"Senate Budget and Fiscal Review Subcommittee No. 3 on Health and Human Services","Budget Subcommittee",CA,"Health and Human Services",NULL,NULL,NULL,2015
458,Senate,"Senate Budget and Fiscal Review Subcommittee No. 4 on State Administration and General Government","Budget Subcommittee",CA,"State Administration and General Government",NULL,NULL,NULL,2015
459,Senate,"Senate Budget and Fiscal Review Subcommittee No. 5 on Corrections, Public Safety and the Judiciary","Budget Subcommittee",CA,"Corrections, Public Safety and the Judiciary",NULL,NULL,NULL,2015
460,Senate,"Senate Business, Professions and Economic Development Subcommittee on California's Innovation, Technology and Life Sciences Economy",Subcommittee,CA,"California's Innovation, Technology and Life Sciences Economy",NULL,NULL,NULL,2015
461,Senate,"Senate Education Subcommittee on Community Schools",Subcommittee,CA,"Community Schools",NULL,NULL,NULL,2015
462,Senate,"Senate Energy, Utilities and Communications Subcommittee on Gas, Electric and Transportation Safety",Subcommittee,CA,"Gas, Electric and Transportation Safety",NULL,NULL,NULL,2015
463,Senate,"Senate Governance and Finance Subcommittee on Modernizing Government",Subcommittee,CA,"Senate Governance and Finance Modernizing Government",NULL,NULL,NULL,2015
464,Senate,"Senate Governmental Organization Subcommittee on Emergencies, Disaster Response and Port Security",Subcommittee,CA,"Senate Governmental Organization Emergencies, Disaster Response and Port Security",NULL,NULL,NULL,2015
465,Senate,"Senate Health Subcommittee on Healthcare Workforce and Access to Care",Subcommittee,CA,"Senate Health Healthcare Workforce and Access to Care",NULL,NULL,NULL,2015
466,Joint,"Joint Legislative Budget Committee",Joint,CA,"Budget Committee",NULL,NULL,NULL,2015
467,Senate,"Senate 1st Extraordinary Session on Appropriations",Extraordinary,CA,Appropriations,NULL,NULL,NULL,2015
468,Senate,"Senate 1st Extraordinary Session on Rules",Extraordinary,CA,Rules,NULL,NULL,NULL,2015
469,Senate,"Senate 1st Extraordinary Session on Transportation and Infrastructure Development",Extraordinary,CA,"Transportation and Infrastructure Development",NULL,NULL,NULL,2015
470,Senate,"Senate 2nd Extraordinary Session on Appropriations",Extraordinary,CA,Appropriations,NULL,NULL,NULL,2015
471,Senate,"Senate 2nd Extraordinary Session on Public Health and Developmental Services",Extraordinary,CA,"Public Health and Developmental Services",NULL,NULL,NULL,2015
472,Senate,"Senate 2nd Extraordinary Session on Rules",Extraordinary,CA,Rules,NULL,NULL,NULL,2015
473,Senate,"Senate Taskforce on Workforce Development",NULL,NY,"Senate Taskforce on Workforce Development",NULL,NULL,NULL,2015
474,Senate,"Senate Task Force on Heroin Task Force","Task Forces and Other Entities",NY,"Heroin Task Force",NULL,NULL,NULL,2015
475,Joint,"Joint Committee on Joint Legislative Budget General Conference Committee",Joint,NY,"Joint Legislative Budget General Conference Committee",NULL,NULL,NULL,2015
476,Joint,"Joint Committee on Joint Legislative Budget Conference Committee: Health",Joint,NY,"Joint Legislative Budget Conference Committee: Health",NULL,NULL,NULL,2015
477,Joint,"Joint Committee on Joint Legislative Budget Conference Committee: Mental Health",Joint,NY,"Joint Legislative Budget Conference Committee: Mental Health",NULL,NULL,NULL,2015
478,Joint,"Joint Committee on Joint Legislative Budget Conference Committee: Transportation",Joint,NY,"Joint Legislative Budget Conference Committee: Transportation",NULL,NULL,NULL,2015
479,Joint,"Joint Committee on Joint Legislative Budget Conference Committee: General Government",Joint,NY,"Joint Legislative Budget Conference Committee: General Government",NULL,NULL,NULL,2015
480,Joint,"Joint Committee on Joint Legislative Budget Conference Committee: Labor",Joint,NY,"Joint Legislative Budget Conference Committee: Labor",NULL,NULL,NULL,2015
481,Joint,"Joint Committee on Joint Legislative Budget Conference Committee: Higher Education",Joint,NY,"Joint Legislative Budget Conference Committee: Higher Education",NULL,NULL,NULL,2015
482,Joint,"Joint Committee on Joint Legislative Budget Conference Committee: Education",Joint,NY,"Joint Legislative Budget Conference Committee: Education",NULL,NULL,NULL,2015
483,Joint,"Joint Committee on Joint Legislative Budget Conference Committee: Economic Development",Joint,NY,"Joint Legislative Budget Conference Committee: Economic Development",NULL,NULL,NULL,2015
484,Joint,"Joint Committee on Joint Legislative Budget Conference Committee: Environmental Conservation",Joint,NY,"Joint Legislative Budget Conference Committee: Environmental Conservation",NULL,NULL,NULL,2015
485,Joint,"Joint Committee on Joint Legislative Budget Conference Committee: Public Protection",Joint,NY,"Joint Legislative Budget Conference Committee: Public Protection",NULL,NULL,NULL,2015
486,Assembly,"Assembly Floor",Floor,NY,"Assembly Floor",NULL,NULL,NULL,2015
487,Senate,"Senate Floor",Floor,NY,"Senate Floor",NULL,NULL,NULL,2015
488,Joint,"Public Hearing",Select,CA,"Public Hearing",NULL,NULL,NULL,2015
489,Joint,"Joint Select Committee on Public Hearing",Select,NY,"Public Hearing",NULL,NULL,NULL,2015
490,Senate,"Senate Legislative Commission on Administrative Regulations Review Commission (ARRC)","Legislative Commissions",NY,"Administrative Regulations Review Commission (ARRC)",NULL,NULL,NULL,2015
491,Senate,"Senate Legislative Commission on Legislative Commission on Rural Resources","Legislative Commissions",NY,"Legislative Commission on Rural Resources",NULL,NULL,NULL,2015
492,Senate,"Senate Temporary Committee on Libraries","Temporary Committee",NY,Libraries,NULL,NULL,NULL,2015
493,Senate,"Senate Task Force on New York State Conference of Black Senators","Task Forces and Other Entities",NY,"New York State Conference of Black Senators",NULL,NULL,NULL,2015
494,Senate,"Senate Task Force on Puerto Rican/Latino Caucus","Task Forces and Other Entities",NY,"Puerto Rican/Latino Caucus",NULL,NULL,NULL,2015
495,Senate,"Senate Temporary Committee on Science, Technology, Incubation and Entrepreneurship","Temporary Committee",NY,"Science, Technology, Incubation and Entrepreneurship",NULL,NULL,NULL,2015
496,Senate,"Senate Temporary Committee on State-Native American Relations","Temporary Committee",NY,"State-Native American Relations",NULL,NULL,NULL,2015
497,Senate,"Senate Task Force on Task Force on Lyme and Tick-Borne Diseases","Task Forces and Other Entities",NY,"Task Force on Lyme and Tick-Borne Diseases",NULL,NULL,NULL,2015
498,Senate,"Senate Task Force on The New York State Black, Puerto Rican, Hispanic and Asian Legislative Caucus","Task Forces and Other Entities",NY,"The New York State Black, Puerto Rican, Hispanic and Asian Legislative Caucus",NULL,NULL,NULL,2015
499,Assembly,"Assembly Standing Committee on Accountability and Administrative Review",Standing,CA,"Accountability and Administrative Review",NULL,NULL,NULL,2015
500,Assembly,"Assembly Special Committee on the Office of the Attorney General",Special,CA,"Office of the Attorney General",NULL,NULL,NULL,2017
501,Senate,"Senate Standing Committee on Aging",Standing,NY,Aging,813,NULL,NULL,2017
502,Senate,"Senate Standing Committee on Agriculture",Standing,NY,Agriculture,412,NULL,NULL,2017
503,Senate,"Senate Standing Committee on Alcoholism And Drug Abuse",Standing,NY,"Alcoholism And Drug Abuse",801,NULL,NULL,2017
504,Senate,"Senate Standing Committee on Banks",Standing,NY,Banks,915,NULL,NULL,2017
505,Senate,"Senate Standing Committee on Children And Families",Standing,NY,"Children And Families",901,NULL,NULL,2017
506,Senate,"Senate Standing Committee on Cities",Standing,NY,Cities,945,NULL,NULL,2017
507,Senate,"Senate Standing Committee on Civil Service And Pensions",Standing,NY,"Civil Service And Pensions",410,NULL,NULL,2017
508,Senate,"Senate Standing Committee on Codes",Standing,NY,Codes,124,NULL,NULL,2017
509,Senate,"Senate Standing Committee on Commerce, Economic Development And Small Business",Standing,NY,"Commerce, Economic Development And Small Business",813,NULL,NULL,2017
510,Senate,"Senate Standing Committee on Consumer Protection",Standing,NY,"Consumer Protection",510,NULL,NULL,2017
511,Senate,"Senate Standing Committee on Corporations, Authorities And Commissions",Standing,NY,"Corporations, Authorities And Commissions",610,NULL,NULL,2017
512,Senate,"Senate Standing Committee on Crime Victims, Crime And Correction",Standing,NY,"Crime Victims, Crime And Correction",123,NULL,NULL,2017
513,Senate,"Senate Standing Committee on Cultural Affairs, Tourism, Parks And Recreation",Standing,NY,"Cultural Affairs, Tourism, Parks And Recreation",904,NULL,NULL,2017
514,Senate,"Senate Standing Committee on Education",Standing,NY,Education,810,NULL,NULL,2017
515,Senate,"Senate Standing Committee on Elections",Standing,NY,Elections,805,NULL,NULL,2017
516,Senate,"Senate Standing Committee on Energy And Telecommunications",Standing,NY,"Energy And Telecommunications",611,NULL,NULL,2017
517,Senate,"Senate Standing Committee on Environmental Conservation",Standing,NY,"Environmental Conservation",307,NULL,NULL,2017
518,Senate,"Senate Standing Committee on Ethics",Standing,NY,Ethics,NULL,NULL,NULL,2017
519,Senate,"Senate Standing Committee on Finance",Standing,NY,Finance,124,NULL,NULL,2017
520,Senate,"Senate Standing Committee on Health",Standing,NY,Health,124,NULL,NULL,2017
521,Senate,"Senate Standing Committee on Higher Education",Standing,NY,"Higher Education",807,NULL,NULL,2017
522,Senate,"Senate Standing Committee on Housing, Construction And Community Development",Standing,NY,"Housing, Construction And Community Development",309,NULL,NULL,2017
523,Senate,"Senate Standing Committee on Infrastructure And Capital Investment",Standing,NY,"Infrastructure And Capital Investment",801,NULL,NULL,2017
524,Senate,"Senate Standing Committee on Insurance",Standing,NY,Insurance,124,NULL,NULL,2017
525,Senate,"Senate Standing Committee on Investigations And Government Operations",Standing,NY,"Investigations And Government Operations",816,NULL,NULL,2017
526,Senate,"Senate Standing Committee on Judiciary",Standing,NY,Judiciary,123,NULL,NULL,2017
527,Senate,"Senate Standing Committee on Labor",Standing,NY,Labor,123,NULL,NULL,2017
528,Senate,"Senate Standing Committee on Local Government",Standing,NY,"Local Government",946,NULL,NULL,2017
529,Senate,"Senate Standing Committee on Mental Health And Developmental Disabilities",Standing,NY,"Mental Health And Developmental Disabilities",816,NULL,NULL,2017
530,Senate,"Senate Subcommittee on New York City Education Subcommittee",Standing,NY,"New York City Education Subcommittee",NULL,NULL,NULL,2017
531,Senate,"Senate Standing Committee on Racing, Gaming And Wagering",Standing,NY,"Racing, Gaming And Wagering",124,NULL,NULL,2017
532,Senate,"Senate Standing Committee on Rules",Standing,NY,Rules,NULL,NULL,NULL,2017
533,Senate,"Senate Standing Committee on Social Services",Standing,NY,"Social Services",801,NULL,NULL,2017
534,Senate,"Senate Standing Committee on Transportation",Standing,NY,Transportation,710,NULL,NULL,2017
535,Senate,"Senate Standing Committee on Veterans, Homeland Security And Military Affairs",Standing,NY,"Veterans, Homeland Security And Military Affairs",124,NULL,NULL,2017
536,Assembly,"Assembly Floor",Floor,CA,"Assembly Floor",,,,2017
537,Assembly,"Assembly Standing Committee on Accountability and Administrative Review",Standing,CA,"Accountability and Administrative Review",357,"(916) 319-3600","(916) 319-3650",2017
538,Assembly,"Assembly Standing Committee on Aging and Long-Term Care",Standing,CA,"Aging and Long-Term Care",360A,"(916) 319-3990","(916) 319-3884",2017
539,Assembly,"Assembly Standing Committee on Agriculture",Standing,CA,Agriculture,362,"(916) 319-2084","(916) 319-2184",2017
540,Assembly,"Assembly Standing Committee on Appropriations",Standing,CA,Appropriations,2114,"(916) 319-2081",,2017
541,Assembly,"Assembly Standing Committee on Arts, Entertainment, Sports, Tourism, and Internet Media",Standing,CA,"Arts, Entertainment, Sports, Tourism, and Internet Media",152,"(916) 319-3450","(916) 319-3451",2017
542,Assembly,"Assembly Standing Committee on Banking and Finance",Standing,CA,"Banking and Finance",6031,"(916) 319-3081","(916) 319-3181",2017
543,Assembly,"Assembly Standing Committee on Budget",Standing,CA,Budget,6026,"(916) 319-2099","(916) 319-2199",2017
544,Assembly,"Assembly Standing Committee on Business and Professions",Standing,CA,"Business and Professions",383,"(916) 319-3301","(916) 319-3306",2017
545,Assembly,"Assembly Standing Committee on Communications and Conveyance",Standing,CA,"Communications and Conveyance",6027,"(916) 319-2637","(916) 319-3560",2017
546,Assembly,"Assembly Standing Committee on Education",Standing,CA,Education,159,"(916) 319-2087","(916) 319-2187",2017
547,Assembly,"Assembly Standing Committee on Elections and Redistricting",Standing,CA,"Elections and Redistricting",365,"(916) 319-2094","(916) 319-2194",2017
