pid,description,twitter_handle,capitol_phone,website_url,room_number,email_form_link,state,lastTouched,dr_id,lastTouched_ts,email,capitol_fax
1,"Isadore Hall, III is an American politician currently serving in the California State Senate. He is a Democrat representing the 35th district, encompassing parts of the South Bay. Hall received a Bachelor of Art's Degree in Business Administration from the University of Phoenix and a Master of Arts Degree in Public Administration from National University. In 2011, Hall was awarded a Master's Degree in Management and Leadership from the University of Southern California, and dual Doctorates in Theology and Religious Studies from Next Dimension Bible College. Hall is a member of Omega Psi Phi fraternity. Born and raised in Compton, California, Hall is the youngest of six children.",@isadorehall,"(916) 651-4035",NULL,4085,https://lcmspubcontact.lc.ca.gov/PublicLCMS/ContactPopup.php?district=sd35,CA,"2017-03-04 01:13:12",1,1488589992,NULL,"(916) 651-4935"
2,"Richard Hershel Bloom (born June 22, 1953) is an American politician currently serving in the California State Assembly. He is a Democrat representing the 50th district, encompassing West Los Angeles, Beverly Hills, Agoura Hills, Malibu, Topanga, Pacific Palisades, Bel Air, Brentwood, Santa Monica, Beverly Hills, West Hollywood, Hancock Park, and Hollywood. Prior to being elected to the state assembly, he was mayor of Santa Monica and served in the Santa Monica City Council for 13 years.",@RichardBloom,"(916) 319-2050",NULL,2003,https://lcmspubcontact.lc.ca.gov/PublicLCMS/ContactPopup.php?district=AD50,CA,"2017-03-04 01:13:12",2,1488589992,NULL,"(916) 319-2150"
3,"Susan Bonilla (born June 22, 1960) is an American politician currently serving in the California State Assembly. She is a Democrat representing the 14th district, encompassing parts of Contra Costa and Solano counties. Prior to being elected to the state assembly, she was a member of the Contra Costa County Board of Supervisors.",@ASMSusanBonilla,"(916) 319-2014",NULL,4149,https://lcmspubcontact.lc.ca.gov/PublicLCMS/ContactPopup.php?district=AD14,CA,"2017-03-04 01:13:12",3,1488589992,NULL,"(916) 319-2114"
4,"Tony K. Thurmond is an American politician currently elected to the California State Assembly. He is a Democrat elected to represent the 15th district, encompassing parts of the East Bay. Prior to being elected to the State Assembly, he was a former Richmond city councilmember.",@TonyThurmond,"(916) 319-2015",NULL,4005,https://lcmspubcontact.lc.ca.gov/PublicLCMS/ContactPopup.php?district=AD15,CA,"2017-03-04 01:13:12",4,1488589992,NULL,"(916) 319-2115"
5,"Katcho Achadjian is an American politician currently serving in the California State Assembly. He is a Republican representing the 35th district, encompassing San Luis Obispo County and a part of Santa Barbara County. Prior to being elected to the state assembly, he was a member of the San Luis Obispo County Board of Supervisors.",@KatchoAchadjian,"(916) 319-2035",NULL,4098,https://lcmspubcontact.lc.ca.gov/PublicLCMS/ContactPopup.php?district=AD35,CA,"2017-03-04 01:13:12",5,1488589992,NULL,"(916) 319-2135"
7,"David Chiu (born April 2, 1970) is an American politician currently serving in the California State Assembly. He is a Democrat representing the 17th district, encompassing the eastern half of San Francisco. Prior to being elected to the state assembly, he was the President of the San Francisco Board of Supervisors and supervisor for District 3, which encompasses the northeastern corner of the city, including Chinatown, North Beach, the Financial District, and Fisherman's Wharf. He was the first Asian American to serve as District 3 supervisor, the first Asian American to serve as board president, and the first supervisor elected to three consecutive terms as board president.",@DavidChiu,"(916) 319-2017",NULL,4112,https://lcmspubcontact.lc.ca.gov/PublicLCMS/ContactPopup.php?district=AD17,CA,"2017-03-04 01:13:12",7,1488589992,NULL,"(916) 319-2117"
8,"Marc Levine is an American politician currently serving in the California State Assembly. He is a Democrat representing the 10th district, encompassing the North Bay in the San Francisco Bay Area. Prior to being elected to the state assembly, he was a San Rafael city councilmember.",@MarcLevine,"(916) 319-2010",NULL,5135,https://lcmspubcontact.lc.ca.gov/PublicLCMS/ContactPopup.php?district=AD10,CA,"2017-03-04 01:13:12",8,1488589992,NULL,"(916) 319-2110"
9,"Luis Alejo (born March 27, 1974) is an American politician currently serving in the California State Assembly representing the 30th district, encompassing the Pajaro and Salinas valleys. Alejo graduated from the University of California, Berkeley with dual bachelors degrees in political science and Chicano studies, and obtained his master's of education degree from Harvard University in administration, planning and social policy. He received his Juris Doctorate (JD) from the University of California, Davis School of Law (King Hall), where he won the "Maggie Schelen" scholarship for public service.",@AsmLuisAlejo,"(916) 319-2030",NULL,2117,https://lcmspubcontact.lc.ca.gov/PublicLCMS/ContactPopup.php?district=AD30,CA,"2017-03-04 01:13:12",9,1488589992,NULL,"(916) 319-2130"
10,"Tom Lackey is an American politician currently serving in the California State Assembly. He is a Republican representing the 36th district, encompassing parts of the Antelope Valley. Prior to being elected to the state assembly, he was a Palmdale city councilmember.",@TomLackey36,"(916) 319-2036",NULL,2174,https://lcmspubcontact.lc.ca.gov/PublicLCMS/ContactPopup.php?district=AD36,CA,"2017-03-04 01:13:12",10,1488589992,NULL,"(916) 319-2136"
11,"Evan Low is an American politician currently serving in the California State Assembly. He is a Democrat representing the 28th district, encompassing parts of the South Bay. Prior to being elected to the state assembly, he was a Campbell city councilmember. In 2013, his colleagues on the Campbell City Council selected him to serve as Mayor for a second time.  When his colleagues selected him to become Campbell mayor in 2009, Low became the youngest openly gay, Asian American Mayor in the nation.",@Evan_Low,"(916) 319-2028",NULL,4126,https://lcmspubcontact.lc.ca.gov/PublicLCMS/ContactPopup.php?district=AD28,CA,"2017-03-04 01:13:12",11,1488589992,NULL,"(916) 319-2128"
12,"Das Williams (born June 29, 1974)[1] is an American politician currently serving in the California State Assembly. He is a Democrat representing the 37th district, encompassing parts of Santa Barbara and Ventura counties. Prior to being elected to the state assembly, he was a member of the Santa Barbara City Council. Before embarking in politics, Williams worked as a junior high school teacher and a legislative aide to then-assemblymember Hannah-Beth Jackson. Williams holds a Master's degree in Environmental Science & Management, with a focus on water pollution, planning processes, and land-use law at UC Santa Barbara's Bren School of Environmental Science & Management. As a UC grad, Williams has opposed fee increases for the UC system.",@DasWilliams,"(916) 319-2037",NULL,4005,https://lcmspubcontact.lc.ca.gov/PublicLCMS/ContactPopup.php?district=AD37,CA,"2017-03-04 01:13:12",12,1488589992,NULL,"(916) 319-2137"
13,"Cheryl Brown is an American politician currently serving in the California State Assembly. She is a Democrat representing the 47th district, encompassing parts of the Inland Empire. Prior to being elected to the state assembly, she was a newspaper publisher.",@AsmCherylBrown,"(916) 319-2047",NULL,2136,https://lcmspubcontact.lc.ca.gov/PublicLCMS/ContactPopup.php?district=AD47,CA,"2017-03-04 01:13:12",13,1488589992,NULL,"(916) 319-2147"
14,"Matthew Harper is an American politician currently serving in the California State Assembly. He is a Republican representing the 74th district, encompassing parts of coastal Orange County. Prior to being elected to the state assembly, he was the 59th mayor of Huntington Beach. Harper was elected to the Huntington Beach City Council November 2, 2010 on a campaign platform of public safety, infrastructure, economic development, administrative and fiscal accountability, property rights, personal freedom and opposition to higher taxes. Harper was elected by the mayors of the Second District to the Orange County Transportation Authority (OCTA) Board of Directors.",@AsmHarper,"(916) 319-2074",NULL,5126,https://lcmspubcontact.lc.ca.gov/PublicLCMS/ContactPopup.php?district=AD74,CA,"2017-03-04 01:13:12",14,1488589992,NULL,"(916) 319-2174"
15,"Kristin Olsen (born January 19, 1974)[1] is an American politician currently serving in the California State Assembly. She is a Republican representing the 12th district. Prior to being elected to the state assembly, she was a member of the Modesto City Council.",@KristinOlsenCA,"(916) 319-2012",NULL,3104,https://lcmspubcontact.lc.ca.gov/PublicLCMS/ContactPopup.php?district=AD12,CA,"2017-03-04 01:13:12",15,1488589992,NULL,"(916) 319-2112"
16,"Jacqui Irwin is an American politician currently serving in the California State Assembly. She is a Democrat representing the 44th district, encompassing parts of Ventura County. Prior to being elected to the state assembly, she was a three term Thousand Oaks city council member, and previous to that was on the Thousand Oaks Planning Commission. Irwin graduated from the University of California, San Diego, where she was an Academic All American swimmer. She had worked as an engineer at the Johns Hopkins University Applied Physics Lab, on the Trident Missile Project and at Teledyne Systems before raising her children.",@jacquiirwin,"(916) 319-2044",NULL,5119,https://lcmspubcontact.lc.ca.gov/PublicLCMS/ContactPopup.php?district=AD44,CA,"2017-03-04 01:13:12",16,1488589992,NULL,"(916) 319-2144"
17,"Miguel Santiago is an American politician currently serving in the California State Assembly. He is a Democrat representing the 53rd district, encompassing parts of Downtown Los Angeles. Prior to being elected to the state assembly, he was a member of the Los Angeles Community College District Board of Trustees.",@SantiagoAD53,"(916) 319-2053",NULL,6027,https://lcmspubcontact.lc.ca.gov/PublicLCMS/ContactPopup.php?district=AD53,CA,"2017-03-04 01:13:12",17,1488589992,NULL,"(916) 319-2153"
18,"Ling-Ling Chang is an American politician currently serving in the California State Assembly. She is a Republican representing the 55th district, encompassing parts of Los Angeles, Orange, and San Bernardino counties. Prior to being elected to the state assembly, she was a Diamond Bar city councilmember.",@AsmL2Chang,"(916) 319-2055",NULL,3149,https://lcmspubcontact.lc.ca.gov/PublicLCMS/ContactPopup.php?district=AD55,CA,"2017-03-04 01:13:12",18,1488589992,NULL,"(916) 319-2155"
19,"Scott Thomas Wilk, Sr. (born March 16, 1959 in Los Angeles, California) is an American politician serving in the California State Assembly. He is a Republican representing the 38th district, encompassing Simi Valley, the northern section of the San Fernando Valley, and most of the Santa Clarita Valley. He currently serves as Chair of the Assembly Republican Caucus. Prior to being elected to the state assembly, he was a College of the Canyons trustee.",@ScottWilkCA,"(916) 319-2038",NULL,4090,https://lcmspubcontact.lc.ca.gov/PublicLCMS/ContactPopup.php?district=AD38,CA,"2017-03-04 01:13:12",19,1488589992,NULL,"(916) 319-2138"
20,"Mark Stone is an American politician currently serving in the California State Assembly. He is a Democrat representing the 29th district, encompassing parts of the northern Central Coast. Prior to being elected to the state assembly, he was a Santa Cruz County supervisor.",@AsmMarkStone,"(916) 319-2029",NULL,3146,https://lcmspubcontact.lc.ca.gov/PublicLCMS/ContactPopup.php?district=AD29,CA,"2017-03-04 01:13:12",20,1488589992,NULL,"(916) 319-2129"
21,"James Cooper is an American politician currently serving in the California State Assembly. He is a Democrat representing the 9th district, encompassing parts of the Sacramento and San Joaquin counties. On his first day in office, Cooper was named to Speaker Toni Atkins' leadership team as Assistant Majority Whip. Cooper grew up in Sacramento and is a graduate of the West Point Leadership Academy and FBI National Academy. He earned a Master's degree in Organizational Leadership from Saint Mary's College.",@AsmJimCooper,"(916) 319-2009",NULL,5158,https://lcmspubcontact.lc.ca.gov/PublicLCMS/ContactPopup.php?district=AD09,CA,"2017-03-04 01:13:12",21,1488589992,NULL,"(916) 319-2109"
22,"Kevin McCarty (born 1972) is an American politician currently serving in the California State Assembly. He is a Democrat representing the 7th district, encompassing parts of the Sacramento metropolitan area. Prior to being elected to the state assembly, he was an Sacramento city councilmember representing the 6th district which includes part of the eastern and southeastern parts of the city. Prior to being elected to the Sacramento City Council, McCarty served as policy director to former California Lieutenant Governor Cruz Bustamante, and as an assembly budget committee consultant to former California State Assembly member Denise Moreno Ducheny. McCarty was first elected to the city council in 2004 after Dave Jones stepped down in order to run for the state assembly. He is a resident of the Elmhurst neighborhood.",@KMcCartyAD7,"(916) 319-2007",NULL,2160,https://lcmspubcontact.lc.ca.gov/PublicLCMS/ContactPopup.php?district=AD07,CA,"2017-03-04 01:13:12",22,1488589992,NULL,"(916) 319-2107"
23,"Bill Quirk (William J. Quirk) is an American politician currently serving in the California State Assembly. He is a Democrat representing the 20th district, encompassing the southern East Bay of the San Francisco Bay Area. Prior to being elected to the state assembly, he was a Hayward city councilmember. Quirk is the only rocket engineer to serve in the California legislature. He has a Ph.D. in astrophysics from Columbia University (1970).",@Bill_Quirk,"(916) 319-2020",NULL,2163,https://lcmspubcontact.lc.ca.gov/PublicLCMS/ContactPopup.php?district=AD20,CA,"2017-03-04 01:13:12",23,1488589992,NULL,"(916) 319-2120"
24,"Edward M. Gaines (born April 25, 1958) is a California State Senator, representing the 1st Senate district. He won a January 4, 2011, special election to replace the late Dave Cox and took office two days later. Prior to his election to the Senate, Gaines was a California State Assemblyman, representing the 4th Assembly district, which is centered on the suburbs of Placer County, which are located east of Sacramento.",@TedGaines,"(916) 651-4001",NULL,3076,https://lcmspubcontact.lc.ca.gov/PublicLCMS/ContactPopup.php?district=sd01,CA,"2017-03-04 01:13:12",24,1488589992,NULL,"(916) 651-4901"
25,"William "Bill" Monning is an American educator, lawyer, and politician. He currently serves in the California State Senate representing the 17th district, encompassing the Central Coast. He previously served in the California State Assembly, representing the 27th district, which included portions of Monterey, Santa Cruz, and Santa Clara Counties. Prior to his service in the state legislature, Monning was a professor at the Monterey College of Law and a professor of International Negotiation and Conflict Resolution at the Monterey Institute of International Studies. He is the former president and co-founder of Global Majority, Inc., an organization committed to education, training and advocacy in the field of non-violent conflict resolution",@billmonning,"(916) 651-4017",NULL,313,https://lcmspubcontact.lc.ca.gov/PublicLCMS/ContactPopup.php?district=sd17,CA,"2017-03-04 01:13:12",25,1488589992,NULL,"(916) 651-4917"
26,"Jeff Stone is an American politician currently serving in the California State Senate. He is a Republican representing the 28th district, encompassing parts of Riverside County. Prior to being elected to the state senate, he was a Riverside County supervisor.",@SenJeffStone,"(916) 651-4028",NULL,4062,https://lcmspubcontact.lc.ca.gov/PublicLCMS/ContactPopup.php?district=sd28,CA,"2017-03-04 01:13:12",26,1488589992,NULL,"(916) 651-4928"
27,"Adam C. Gray is an American politician currently serving in the California State Assembly. He is a Democrat representing the 21st district, encompassing all of Merced County and portions of Stanislaus County.",@GrayForAssembly,"(916) 319-2021",NULL,4117,https://lcmspubcontact.lc.ca.gov/PublicLCMS/ContactPopup.php?district=AD21,CA,"2017-03-04 01:13:12",27,1488589992,NULL,"(916) 319-2121"
28,"Mike Gipson is an American politician currently serving in the California State Assembly. He is a Democrat representing the 64th district, encompassing parts of the South Bay. Prior to being elected to the state assembly, he was a Carson city councilmember.",@mgipson2014,"(916) 319-2064",NULL,4164,https://lcmspubcontact.lc.ca.gov/PublicLCMS/ContactPopup.php?district=AD64,CA,"2017-03-04 01:13:12",28,1488589992,NULL,"(916) 319-2164"
29,"Marie Waldron is an American politician currently serving in the California State Assembly. She is a Republican representing the 75th district, encompassing parts of inland northern Riverside and San Diego counties. Prior to being elected to the state assembly, she was an Escondido city councilmember.",@ConservtveWoman,"(916) 319-2075",NULL,4130,https://lcmspubcontact.lc.ca.gov/PublicLCMS/ContactPopup.php?district=AD75,CA,"2017-03-04 01:13:12",29,1488589992,NULL,"(916) 319-2175"
30,"Philip Y. Ting is an American politician currently serving in the California State Assembly. He is a Democrat representing the 19th district, encompassing western San Francisco and northern San Mateo County. Prior to being elected to the state assembly, he was the Assessor-Recorder of San Francisco.",@PhilTing,"(916) 319-2019",NULL,6026,https://lcmspubcontact.lc.ca.gov/PublicLCMS/ContactPopup.php?district=AD19,CA,"2017-03-04 01:13:12",30,1488589992,NULL,"(916) 319-2119"
31,"Kevin Mullin is an American politician currently serving in the California State Assembly.[1] He is a Democrat representing the 22nd district, encompassing the cities of Belmont, Brisbane, Burlingame, Foster City, Hillsborough, Millbrae, Pacifica, Redwood City, San Bruno, San Carlos, San Mateo portions of South San Francisco and the Coastside communities of Montara and Moss Beach. Prior to being elected to the state assembly, Mullin was a South San Francisco city councilmember and Mayor, a local business owner, and former state legislative aide.",@kevinmullin,"(916) 319-2022",NULL,3160,https://lcmspubcontact.lc.ca.gov/PublicLCMS/ContactPopup.php?district=AD22,CA,"2017-03-04 01:13:12",31,1488589992,NULL,"(916) 319-2122"
32,"Kansen Chu is an American politician currently serving in the California State Assembly. He is a Democrat representing the 25th district, encompassing parts of the South Bay. Prior to being elected to the state assembly, he was a San Jose city councilmember representing District 4, which encompasses the communities of Berryessa, Alviso, and North San Jose. Elected in June 2007, Chu was the first Chinese-American to serve on the City Council. ",@kansenchu,"(916) 319-2025",NULL,5175,https://lcmspubcontact.lc.ca.gov/PublicLCMS/ContactPopup.php?district=AD25,CA,"2017-03-04 01:13:12",32,1488589992,NULL,"(916) 319-2125"
33,"Henry T. Perea (born June 29, 1977 in Fresno, California) was elected to the California State Assembly in November 2010. He is a Democrat representing the 31st district, encompassing western Fresno. Prior to his election to the Assembly, Perea served on the Fresno city council from 2003 to 2010. He was first elected to the council at the age of 25 and served as council president in 2007. He is married to Yahaira Garcia-Perea and they have one daughter, Ava. His father, Henry R. Perea, is a member of the Fresno County Board of Supervisors.",@AsmPerea,"(916) 319-2031",NULL,3120,https://lcmspubcontact.lc.ca.gov/PublicLCMS/ContactPopup.php?district=AD31,CA,"2017-03-04 01:13:12",33,1488589992,NULL,"(916) 319-2131"
34,"Rudy Salas is an American politician currently serving in the California State Assembly. He is a Democrat representing the 32nd district, encompassing parts of the southern Central Valley. Prior to being elected to the State Assembly, he was a Bakersfield city councilmember.",@rudysalasjr,"(916) 319-2032",NULL,2188,https://lcmspubcontact.lc.ca.gov/PublicLCMS/ContactPopup.php?district=AD32,CA,"2017-03-04 01:13:12",34,1488589992,NULL,"(916) 319-2132"
35,"Marc Steinorth is an American politician currently serving in the California State Assembly. He is a Republican representing the 40th district, encompassing parts of the Inland Empire. Prior to being elected to the state assembly, he was a Rancho Cucamonga city councilmember.",@MarcSteinorth,"(916) 319-2040",NULL,2111,https://lcmspubcontact.lc.ca.gov/PublicLCMS/ContactPopup.php?district=AD40,CA,"2017-03-04 01:13:12",35,1488589992,NULL,"(916) 319-2140"
36,"Adrin Nazarian (born March 19, 1973) is an American politician and member of the California State Assembly representing the 46th district, encompassing the central-southern San Fernando Valley in Los Angeles. He is a member of the Democratic Party.",@adrinnazarian,"(916) 319-2046",NULL,4146,https://lcmspubcontact.lc.ca.gov/PublicLCMS/ContactPopup.php?district=AD46,CA,"2017-03-04 01:13:12",36,1488589992,NULL,"(916) 319-2146"
37,"Roger Hernandez is an American politician currently serving in the California State Assembly. He is a Democrat representing the 48th district, encompassing parts of the San Gabriel Valley in Los Angeles County. Prior to being elected to the state assembly, he was the Mayor of West Covina, a member of the West Covina City Council, and Professor of Government at Rio Hondo and Citrus Community Colleges. Prior to his tenure on the City Council, Hernandez was elected to the Rowland Unified School Board where he served from November 1999 through July 2003. Hernandez has a degree in Political Science from the University of California, Riverside, a Master's degree in Public Administration from the University of La Verne and a Master's in Governance Certificate from the California School Boards Association (CSBA).",@Roger_Hernandez,"(916) 319-2048",NULL,5016,https://lcmspubcontact.lc.ca.gov/PublicLCMS/ContactPopup.php?district=AD48,CA,"2017-03-04 01:13:12",37,1488589992,NULL,"(916) 319-2148"
38,"Cristina Garcia is an American politician serving in the California State Assembly. She is a Democrat representing the 58th district, encompassing parts of southeastern Los Angeles County. Prior to being elected to the state assembly, she was a teacher and a community activist. Garcia was elected in November 2012 to represent California's 58th Assembly District.",@voteforgarcia,"(916) 319-2056",NULL,4140,https://lcmspubcontact.lc.ca.gov/PublicLCMS/ContactPopup.php?district=AD56,CA,"2017-03-04 01:13:12",38,1488589992,NULL,"(916) 319-2156"
39,"Eric Linder is an American politician of Hispanic descent, currently serving in the California State Assembly. He is a Republican representing the 60th district, encompassing far western Riverside County. Prior to being elected to the state assembly, he was an owner of a campaign marketing firm and vice chair of the Riverside County Republican Party.",@EricLinder,"(916) 319-2060",NULL,2016,https://lcmspubcontact.lc.ca.gov/PublicLCMS/ContactPopup.php?district=AD60,CA,"2017-03-04 01:13:12",39,1488589992,NULL,"(916) 319-2160"
40,"David Hadley is an American politician currently serving in the California State Assembly. He is a Republican representing the 66th district, encompassing parts of the South Bay. Prior to being elected to the state assembly, he was an entrepreneur and investment banker. Prior to committing to run for the California State Assembly, Hadley was the chairman of the Republican Party for the 66th State Assembly District after having been elected to the leadership of the Republican Party of Los Angeles County in 2012. Under his leadership, the local Republican Party formed a community of supporters called the South Bay 100. This group raised more money in 2013 than any other Republican Assembly District central committee in the state.",@DavidHadleyCA,"(916) 319-2066",NULL,4102,https://lcmspubcontact.lc.ca.gov/PublicLCMS/ContactPopup.php?district=AD66,CA,"2017-03-04 01:13:12",40,1488589992,NULL,"(916) 319-2166"
41,"Melissa Melendez is an American politician serving in the California State Assembly. She is a Republican representing the 67th district, encompassing parts of western Riverside County. Prior to being elected to the state assembly, she was a Lake Elsinore city council member.",@asmMelendez,"(916) 319-2067",NULL,3098,https://lcmspubcontact.lc.ca.gov/PublicLCMS/ContactPopup.php?district=AD67,CA,"2017-03-04 01:13:12",41,1488589992,NULL,"(916) 319-2167"
42,"Brian W. Jones (born August 9, 1968) is an American politician currently serving in the California State Assembly. He is a Republican representing the 71st district, encompassing most of inland San Diego County. On August 20, 2012 he was promoted to Chair of the California Assembly Republican Caucus. Prior to being elected to the state assembly, he was a member of the Santee City Council.",@AsmBrianJones,"(916) 319-2071",NULL,3141,https://lcmspubcontact.lc.ca.gov/PublicLCMS/ContactPopup.php?district=AD71,CA,"2017-03-04 01:13:12",42,1488589992,NULL,"(916) 319-2171"
